{"profile_id":"master-gdd","version":1,"artifact_types":["design-document"],"audiences":["design","engineering","art","qa","production"],"required_sections":[{"id":"product-model","title":"Product vision and player model"},{"id":"systems-content","title":"Systems, content, and interfaces"},{"id":"delivery-governance","title":"Delivery, evidence, decisions, and change control"}],"required_tables":[{"id":"gdd-system-index-table","section_id":"systems-content","columns":["System","Owner","Canonical spec","Dependencies","Status"]}],"required_diagrams":[{"id":"skillstead-gdd-dependency-diagram","section_id":"systems-content","purpose":"Map cross-system and content dependencies","alt_text":"Dependency graph linking core systems, content, UI, data, and production owners"}],"required_images":[{"id":"gdd-world-and-play-image","section_id":"product-model","purpose":"Anchor the intended world and play experience","alt_text":"Approved project-owned overview image connecting world context and core play"}],"recommended_images":[],"length_guidance":{"min_words":3500,"max_words":12000,"min_pages":15,"max_pages":60},"ppt_story_contract":{},"acceptance_criteria":["The document acts as an index to canonical subsystem specifications instead of duplicating conflicting details.","Material claims, assumptions, open questions, decision history, ownership, and change impact are traceable."],"export_rules":{"required_formats":["md","pdf","docx"],"forbidden_formats":["pptx"]},"quality_checks":["cross-reference-integrity","dependency-coverage","change-control"]}
