{"profile_id":"narrative-quest-npc-specification","version":1,"artifact_types":["design-document"],"audiences":["narrative","design","art","engineering","qa"],"required_sections":[{"id":"narrative-intent","title":"Narrative purpose, characters, and player knowledge"},{"id":"quest-contract","title":"Quest flow, NPC states, dependencies, and failure handling"}],"required_tables":[{"id":"quest-beat-table","section_id":"quest-contract","columns":["Beat","Trigger","NPC state","Player choice","World change","Fallback"]}],"required_diagrams":[{"id":"skillstead-quest-flow-diagram","section_id":"quest-contract","purpose":"Map quest branches and cross-discipline dependencies","alt_text":"Quest flow showing triggers, player choices, NPC states, outcomes, and fallback paths"}],"required_images":[{"id":"npc-story-beat-image","section_id":"narrative-intent","purpose":"Clarify staging and emotional intent","alt_text":"Original storyboard frame showing NPC, player position, focal action, and intended emotion"}],"recommended_images":[],"length_guidance":{"min_words":1400,"max_words":5000,"min_pages":6,"max_pages":20},"ppt_story_contract":{},"acceptance_criteria":["Quest logic distinguishes authored fact, player-visible knowledge, conditional inference, and unresolved narrative decisions.","Every branch specifies triggers, NPC state, gameplay dependency, localization need, failure recovery, and test evidence."],"export_rules":{"required_formats":["md","pdf","docx"],"forbidden_formats":["pptx"]},"quality_checks":["branch-completeness","knowledge-consistency","cross-discipline-dependency"]}
