{"profile_id":"rule-state-exception-matrix","version":1,"artifact_types":["review-report"],"audiences":["design","engineering","qa"],"required_sections":[{"id":"state-model","title":"State vocabulary and transition model"},{"id":"exception-resolution","title":"Rule precedence, exceptions, and recovery"}],"required_tables":[{"id":"rule-state-exception-table","section_id":"exception-resolution","columns":["Rule","State","Trigger","Expected result","Exception","Recovery","Test"]}],"required_diagrams":[{"id":"skillstead-rule-state-diagram","section_id":"state-model","purpose":"Expose legal, illegal, and recovery transitions","alt_text":"State graph distinguishing normal transitions, blocked transitions, and recovery paths"}],"required_images":[{"id":"exception-feedback-image","section_id":"exception-resolution","purpose":"Show player-facing exception feedback","alt_text":"Interface example showing an exception state, explanation, and recovery action"}],"recommended_images":[],"length_guidance":{"min_words":600,"max_words":1800,"min_pages":3,"max_pages":8},"ppt_story_contract":{},"acceptance_criteria":["Every reachable state and priority rule has deterministic behavior for normal, invalid, interrupted, and recovery paths.","Each exception maps to visible feedback, logging, ownership, and a reproducible test."],"export_rules":{"required_formats":["md","pdf"],"forbidden_formats":["pptx"]},"quality_checks":["state-reachability","rule-precedence","recovery-coverage"]}
