{"profile_id":"recruiter-portfolio-presentation","version":1,"artifact_types":["presentation"],"audiences":["recruiter","hiring-manager"],"required_sections":[{"id":"candidate-fit","title":"Target role, value proposition, and selected proof"},{"id":"proof-case","title":"Contribution, decisions, outcomes, and next conversation"}],"required_tables":[{"id":"portfolio-claim-table","section_id":"proof-case","columns":["Claim","Artifact","My contribution","Evidence date","Confidence","Role relevance"]}],"required_diagrams":[{"id":"skillstead-portfolio-story-diagram","section_id":"proof-case","purpose":"Connect role needs to selected evidence and hiring decision","alt_text":"Decision-oriented story map from target-role needs through candidate contribution and proof to interview invitation"}],"required_images":[{"id":"portfolio-hero-proof-image","section_id":"candidate-fit","purpose":"Lead with the strongest role-relevant authored proof","alt_text":"Redacted project-owned portfolio artifact showing the candidate's strongest relevant contribution"}],"recommended_images":[],"length_guidance":{"min_words":350,"max_words":1100},"ppt_story_contract":{"min_slides":6,"max_slides":10,"required_diagram_ids":["skillstead-portfolio-story-diagram"],"required_image_ids":["portfolio-hero-proof-image"],"audience_required":true,"decision_purpose_required":true,"one_message_per_slide":true,"required_slide_fields":["id","title","message","purpose","source_section_ids","visual_slots","speaker_notes_required"],"allowed_section_ids":["candidate-fit","proof-case"],"visual_bindings":[{"visual_slot_id":"skillstead-portfolio-story-diagram","section_id":"proof-case"},{"visual_slot_id":"portfolio-hero-proof-image","section_id":"candidate-fit"}],"speaker_note_policy":"required-for-every-slide"},"acceptance_criteria":["The deck leads the hiring audience through role fit, selected contribution evidence, outcomes, and a clear next decision rather than mirroring document headings.","Each slide has one claim, source and visual bindings are auditable, and notes preserve evidence limits, confidentiality, and speaking cues."],"export_rules":{"required_formats":["pptx","pdf"],"forbidden_formats":[]},"quality_checks":["hiring-decision-story","contribution-proof","slide-readability"]}
