{"profile_id":"career-stage-role-map","version":1,"artifact_types":["career-document"],"audiences":["learner","mentor","career-coach"],"required_sections":[{"id":"current-stage","title":"Current stage, constraints, and evidence"},{"id":"role-paths","title":"Target roles, transitions, and validation"}],"required_tables":[{"id":"career-role-table","section_id":"role-paths","columns":["Role","Expected work","Evidence","Gap","Freshness","Next validation"]}],"required_diagrams":[{"id":"skillstead-career-role-roadmap-diagram","section_id":"role-paths","purpose":"Map multiple evidence-based role transitions","alt_text":"Career roadmap from current evidence through alternative role paths, prerequisites, and validation gates"}],"required_images":[{"id":"career-work-context-image","section_id":"current-stage","purpose":"Clarify the kind of work being evaluated","alt_text":"Neutral work-context illustration showing game design collaboration and artifact review"}],"recommended_images":[],"length_guidance":{"min_words":800,"max_words":2200,"min_pages":3,"max_pages":9},"ppt_story_contract":{},"acceptance_criteria":["Current capability facts, inferred fit, constraints, evidence freshness, and unknowns are labeled separately.","Each role path identifies expected work, proof already held, gaps, prerequisite evidence, and a reversible next test."],"export_rules":{"required_formats":["md","pdf"],"forbidden_formats":["pptx"]},"quality_checks":["fact-inference-separation","evidence-freshness","path-reversibility"]}
