{"profile_id":"executive-pitch","version":1,"artifact_types":["presentation"],"audiences":["executive","publisher","investment-committee"],"required_sections":[{"id":"decision-case","title":"Audience decision, player opportunity, and differentiated promise"},{"id":"delivery-case","title":"Proof, scope, economics, risks, and requested commitment"}],"required_tables":[{"id":"pitch-proof-table","section_id":"delivery-case","columns":["Claim","Evidence","Freshness","Confidence","Decision relevance"]}],"required_diagrams":[{"id":"skillstead-pitch-dependency-diagram","section_id":"delivery-case","purpose":"Show how product proof, delivery dependencies, and requested decision connect","alt_text":"Decision map from player opportunity and product proof through delivery dependencies to requested commitment"}],"required_images":[{"id":"pitch-key-art-image","section_id":"decision-case","purpose":"Communicate the original product promise without borrowed identity","alt_text":"Project-owned pitch concept expressing the player fantasy and distinctive interaction"}],"recommended_images":[],"length_guidance":{"min_words":500,"max_words":1600},"ppt_story_contract":{"min_slides":7,"max_slides":12,"required_diagram_ids":["skillstead-pitch-dependency-diagram"],"required_image_ids":["pitch-key-art-image"],"story_rules":[{"id":"audience","order":1},{"id":"decision-purpose","order":2},{"id":"message-per-slide","order":3},{"id":"source-section-binding","order":4,"section_id":"decision-case"},{"id":"visual-slot-binding","order":5,"diagram_id":"skillstead-pitch-dependency-diagram"},{"id":"speaker-note-policy","order":6}]},"acceptance_criteria":["The sequence leads a named decision audience from opportunity and proof to risk-adjusted request, with one message per slide.","Every material claim is source-bound, every visual is slot-bound, and speaker notes distinguish evidence, inference, and delivery cue."],"export_rules":{"required_formats":["pptx","pdf"],"forbidden_formats":[]},"quality_checks":["decision-story","claim-evidence-binding","slide-readability"]}
