{"profile_id":"design-transfer-decision","version":1,"artifact_types":["review-report"],"audiences":["design","production","engineering","qa"],"required_sections":[{"id":"transfer-proposals","title":"Evidence-bound transfer proposals"},{"id":"human-review-handoff","title":"Constraints, risks, validation, and pending review"}],"required_tables":[{"id":"transfer-decision-table","section_id":"transfer-proposals","columns":["Source system","Decision","Evidence","Constraints","Risks","Validation"]}],"required_diagrams":[{"id":"transfer-decision-flow","section_id":"human-review-handoff","purpose":"Show pending review, validation, and human decision handoff","alt_text":"Decision flow from evidence-bound transfer proposal through risk validation to pending human review"}],"required_images":[{"id":"transfer-evidence-image","section_id":"transfer-proposals","purpose":"Anchor a transfer proposal to its observed source-system evidence","alt_text":"Annotated source-system evidence image linked to the transfer proposal"}],"recommended_images":[],"length_guidance":{"min_words":500,"max_words":2200,"min_pages":2,"max_pages":8},"ppt_story_contract":{},"acceptance_criteria":["Every adopt, adapt, reject, or hold proposal remains pending review and binds to its deep dive.","Constraints, risks, validation steps, and explicit human decision ownership are present without mutating a canonical system specification."],"export_rules":{"required_formats":["md","pdf","docx"],"forbidden_formats":["pptx"]},"quality_checks":["pending-review-preserved","transfer-traceability","validation-plan-completeness"]}
