{"profile_id":"liveops-event-experiment-plan","version":1,"artifact_types":["design-document"],"audiences":["liveops","analytics","production","qa","support"],"required_sections":[{"id":"event-hypothesis","title":"Player value, hypothesis, cohort, and guardrails"},{"id":"event-operation","title":"Schedule, content, experiment, telemetry, and rollback"}],"required_tables":[{"id":"experiment-cell-table","section_id":"event-operation","columns":["Cell","Eligibility","Change","Primary metric","Guardrail","Stop rule"]}],"required_diagrams":[{"id":"skillstead-live-service-lifecycle-diagram","section_id":"event-operation","purpose":"Map event lifecycle and operational decisions","alt_text":"Lifecycle from preparation through launch, monitoring, intervention, close, and retrospective"}],"required_images":[{"id":"event-communication-image","section_id":"event-hypothesis","purpose":"Validate event communication clarity","alt_text":"Original event communication concept showing timing, rewards, eligibility, and key conditions"}],"recommended_images":[],"length_guidance":{"min_words":1200,"max_words":4200,"min_pages":5,"max_pages":16},"ppt_story_contract":{},"acceptance_criteria":["The plan defines hypothesis, cohort, freshness timestamp, metrics, guardrails, instrumentation, support impact, and stop criteria.","Reward claims, eligibility, time limits, experiment consent boundaries, rollback, and compensation are unambiguous."],"export_rules":{"required_formats":["md","pdf","docx"],"forbidden_formats":["pptx"]},"quality_checks":["experiment-validity","operational-readiness","player-protection"]}
