{"profile_id":"portfolio-project-brief","version":1,"artifact_types":["career-document"],"audiences":["candidate","mentor","portfolio-reviewer"],"required_sections":[{"id":"project-case","title":"Target role, problem, constraints, and proof goal"},{"id":"execution-plan","title":"Scope, artifacts, milestones, feedback, and risks"}],"required_tables":[{"id":"portfolio-deliverable-table","section_id":"execution-plan","columns":["Deliverable","Competency proof","Owner","Exit criterion","Risk","Review"]}],"required_diagrams":[{"id":"skillstead-portfolio-roadmap-dependency-diagram","section_id":"execution-plan","purpose":"Connect project scope to evidence-producing milestones","alt_text":"Portfolio project roadmap linking role needs, deliverables, dependencies, feedback gates, and final proof"}],"required_images":[{"id":"portfolio-direction-image","section_id":"project-case","purpose":"Set an original project-owned visual direction","alt_text":"Original portfolio project concept illustrating the intended player problem and interaction"}],"recommended_images":[],"length_guidance":{"min_words":800,"max_words":2600,"min_pages":3,"max_pages":11},"ppt_story_contract":{},"acceptance_criteria":["The project is scoped to prove named target-role competencies rather than merely produce volume.","Ownership, borrowed assets, assumptions, dependencies, milestones, feedback, evidence capture, and stop conditions are explicit."],"export_rules":{"required_formats":["md","pdf"],"forbidden_formats":["pptx"]},"quality_checks":["role-proof-alignment","scope-feasibility","provenance-plan"]}
