{"profile_id":"game-analysis-report","version":1,"artifact_types":["review-report"],"audiences":["portfolio-reviewer","designer","mentor"],"required_sections":[{"id":"analysis-question","title":"Question, method, play context, and evidence"},{"id":"analysis-findings","title":"Findings, interpretation, implications, and limits"}],"required_tables":[{"id":"analysis-finding-table","section_id":"analysis-findings","columns":["Finding","Observation","Source","Inference","Confidence","Design implication"]}],"required_diagrams":[{"id":"skillstead-analysis-flow-diagram","section_id":"analysis-findings","purpose":"Explain the analyzed player experience and causal hypothesis","alt_text":"Player experience flow with observed behavior, system response, inferred cause, and outcome"}],"required_images":[{"id":"analysis-evidence-image","section_id":"analysis-question","purpose":"Provide cited visual observation","alt_text":"Lawfully captured and cited gameplay frame annotated only for the analysis question"}],"recommended_images":[],"length_guidance":{"min_words":1200,"max_words":4000,"min_pages":5,"max_pages":16},"ppt_story_contract":{},"acceptance_criteria":["Play version, date, platform, context, sources, method, and limitations make evidence freshness auditable.","The report separates observed facts, player interpretation, causal inference, alternatives, and transferable design insight."],"export_rules":{"required_formats":["md","pdf"],"forbidden_formats":["pptx"]},"quality_checks":["context-traceability","causal-humility","transferable-insight"]}
